{
  "$schema": "https://raw.githubusercontent.com/cordisx/cordisx-protocol/main/schemas/marketplace-feed.v8.schema.json",
  "schemaVersion": 8,
  "generatedAt": "2026-09-20T00:00:00Z",
  "trust": {
    "authority": "cordisx.marketplace.codeowners/v1",
    "root": "https://example.com/marketplace.json",
    "grantModel": "protected-merge-chain-v1",
    "cryptographicAttestation": "unsupported"
  },
  "fallbackLocale": "en",
  "name": "Example Marketplace",
  "description": "Scoped and unscoped package examples.",
  "homepage": "https://example.com/marketplace",
  "plugins": [{
    "$schema": "https://raw.githubusercontent.com/cordisx/cordisx-protocol/main/schemas/marketplace-plugin.v8.schema.json",
    "schemaVersion": 8,
    "id": "animal",
    "fallbackLocale": "en",
    "name": "Animal",
    "description": "An unscoped npm package artifact.",
    "version": "0.1.2",
    "source": "https://github.com/example/plugin-composer-animal",
    "artifact": {
      "packageName": "plugin-composer-animal",
      "downloadUrl": "https://github.com/example/plugin-composer-animal/releases/download/v0.1.2/plugin-composer-animal-0.1.2.tgz",
      "integrity": "sha256:eeeeeeeeeeeeeeeeeeeeeeeeeeeeeeeeeeeeeeeeeeeeeeeeeeeeeeeeeeeeeeee"
    },
    "license": "MIT",
    "compatibility": { "cordisx": "^0.1.0" },
    "authors": [{ "name": "Example developer" }]
  }],
  "official": [],
  "certifications": []
}
